{
  "defaultTier": "mid",
  "taskTypes": [
    {
      "taskType": "classify",
      "tier": "cheap",
      "minTier": "cheap"
    },
    {
      "taskType": "post.draft",
      "tier": "mid"
    },
    {
      "taskType": "judge",
      "tier": "mid",
      "judgeFamily": "other_than_implementer"
    },
    {
      "taskType": "cos.plan",
      "tier": "deep",
      "notes": "planning"
    }
  ],
  "escalation": {
    "riskHigh": 1,
    "filesOver": 8,
    "filesStep": 1,
    "failedAttempt": 1
  },
  "keywords": [
    {
      "id": "classify",
      "match": [
        "classify",
        "tag"
      ],
      "taskType": "classify"
    }
  ],
  "classifier": {
    "taskType": "classify",
    "tier": "cheap"
  },
  "flagFloors": {
    "irreversible": "deep",
    "external": "deep"
  }
}
